<?xml version="1.0" encoding="UTF-8"?>
<DynastoreConfigurations xmlns:xsi="http://www.w3.org/2001/XMLSchema-instance"
	xsi:noNamespaceSchemaLocation="dynastore.xsd">
    <DynastoreConfiguration  isEnabled="true"><!-- isEnabled mandatory from True and false -->
        <DynastoreName version="v1">PicArea</DynastoreName><!-- Name and version are mandatory and of type string-->
       
        
        <DynastoreInitializer required="false" type="CUSTOM" > <!-- Not Mandatory for no Initialization -->
			<CustomBuilder>
				<builder>com.attunedlabs.permastore.config.PICAddressBuilder</builder>
			</CustomBuilder>
		</DynastoreInitializer>
		
        
        <AccessScope> <!-- Non Mandatory, is not given Feature is default -->
            <Getter>Feature</Getter> <!--Access Scope can be Feature|FeatureGroup|Site. -->
        </AccessScope>
        <PublishEvent><!-- Only eventId are listed and Event description,dispatcher Chanel,Transformation is given in Eventing.xml, Mandatory-->
            <onReload></onReload> <!-- Non Mandatory -->
            <onTermination></onTermination><!-- Non Mandatory -->
            <onEntryAdded></onEntryAdded><!-- Non Mandatory -->
            <onEntryDeleted></onEntryDeleted><!-- Non Mandatory -->
            <onEntryUpdated></onEntryUpdated><!-- Non Mandatory -->
        </PublishEvent>
    </DynastoreConfiguration>
</DynastoreConfigurations>
